{
  "$schema": "https://json-schema.org/draft/2020-12/schema",
  "$id": "https://raw.githubusercontent.com/Raaif-Yousuf/DNA-Entropy-Graph/main/docs/contract/manifest.schema.json",
  "type": "object",
  "title": "JobManifest (manifest.json)",
  "properties": {
    "schema": {
      "type": "integer"
    },
    "jobId": {
      "type": "string"
    },
    "inputs": {
      "type": "array",
      "items": {
        "type": "object",
        "title": "InputSpec",
        "properties": {
          "id": {
            "type": "string"
          },
          "name": {
            "type": "string"
          },
          "path": {
            "type": "string"
          },
          "informat": {
            "type": "string"
          },
          "start": {
            "type": "integer"
          },
          "rna": {
            "type": "boolean"
          },
          "genes": {
            "type": "boolean"
          },
          "ambiguityPolicy": {
            "type": "string",
            "enum": [
              "keep",
              "mask",
              "error"
            ]
          },
          "fastaRecords": {
            "type": "string"
          },
          "annotation": {
            "type": [
              "string",
              "null"
            ]
          },
          "accession": {
            "type": [
              "string",
              "null"
            ]
          },
          "accessionRange": {
            "type": [
              "string",
              "null"
            ]
          }
        },
        "required": [
          "id",
          "name"
        ]
      }
    },
    "predictor": {
      "type": "object",
      "title": "PredictorSpec",
      "properties": {
        "kind": {
          "type": "string"
        },
        "model": {
          "type": "string"
        },
        "precision": {
          "type": "string"
        },
        "device": {
          "type": "string"
        },
        "seed": {
          "type": "integer"
        }
      }
    },
    "analysis": {
      "type": "object",
      "title": "AnalysisSpec",
      "properties": {
        "contextLength": {
          "type": "integer"
        },
        "window": {
          "type": "integer"
        },
        "stride": {
          "type": "integer"
        },
        "direction": {
          "type": "string",
          "enum": [
            "both-combined",
            "both-averaged",
            "both-separate",
            "forward-only",
            "reverse-only"
          ]
        },
        "format": {
          "type": "string",
          "enum": [
            "bedgraph",
            "wig"
          ]
        },
        "topology": {
          "type": "string",
          "enum": [
            "auto",
            "linear",
            "circular"
          ]
        },
        "regionThreshold": {
          "type": "number"
        },
        "regionMinLength": {
          "type": "integer"
        },
        "regionMergeGap": {
          "type": "integer"
        },
        "gcWindow": {
          "type": "integer"
        },
        "smoothingWindows": {
          "type": "array",
          "items": {
            "type": "integer"
          }
        }
      }
    },
    "outputs": {
      "type": "array",
      "items": {
        "type": "string"
      }
    },
    "limits": {
      "type": "object",
      "title": "Limits",
      "properties": {
        "maxRunSeconds": {
          "type": "integer"
        },
        "cancelPollSeconds": {
          "type": "integer"
        },
        "heartbeatSeconds": {
          "type": "integer"
        },
        "maxInputs": {
          "type": "integer"
        },
        "maxTotalNt": {
          "type": "integer"
        }
      }
    },
    "lifecycle": {
      "type": "object",
      "title": "Lifecycle",
      "properties": {
        "afterTask": {
          "type": "string"
        },
        "keepAliveMinutes": {
          "type": "integer"
        },
        "afterKeepAlive": {
          "type": "string"
        }
      }
    },
    "store": {
      "type": "object",
      "title": "StoreSpec",
      "properties": {
        "kind": {
          "type": "string"
        },
        "bucket": {
          "type": "string"
        },
        "prefix": {
          "type": "string"
        },
        "root": {
          "type": "string"
        }
      },
      "required": [
        "kind"
      ]
    },
    "worker": {
      "type": "object",
      "title": "WorkerRef",
      "properties": {
        "image": {
          "type": "string"
        },
        "version": {
          "type": "string"
        }
      }
    },
    "preset": {
      "type": [
        "object",
        "null"
      ],
      "title": "PresetSpec",
      "properties": {
        "id": {
          "type": "string"
        },
        "name": {
          "type": "string"
        }
      },
      "required": [
        "id",
        "name"
      ]
    }
  },
  "required": [
    "schema",
    "jobId",
    "inputs",
    "predictor",
    "analysis",
    "outputs",
    "limits",
    "lifecycle",
    "store"
  ]
}
